Cod. Cliente;Razão Social;Cod. Categoria;Desc. Categoria;Cod. Grupo;Desc. Grupo;Cod. Bônus;Desc. Bônus;Data Cadastro;Status
288;MT Medeiros Projetos e Serviços Ltda;6;Empresas / Estados RJ; MG e ES;1;;;;09/11/2009;Aprovado
289;Centro de Hematologia de São Paulo;5;Empresas / Estado de São Paulo;1;;;;10/11/2009;Aprovado
290;PAC PROMMOS COMUNICAÇÃO PROMOÇÃO E MERCHANDISING LTDA;5;Empresas / Estado de São Paulo;1;;;;12/11/2009;Aprovado
291;Associação Instituto Missionário;3;Órgãos Públicos e Empresas Estatais;1;;;;17/11/2009;Aprovado
292;associação instituro missionário;5;Empresas / Estado de São Paulo;1;;;;25/11/2009;Aprovado
293;Latina Manutenção de Rodovias Ltda.;5;Empresas / Estado de São Paulo;1;;;;27/11/2009;Aprovado
