Data Solicitação;Data Aprovação;Data Programada;Data Recebimento;Número Solicitação;Cod. Cliente;Razão Social;UF Cliente;Qtd. Cartuchos;Cód. Categoria;Desc. Categoria;Transportadora;Status
28/09/2009;28/09/2009;;;C09090005140;221;S/A O Estado de São Paulo;SP;70;5;Empresas / Estado de São Paulo;ATLAS LOGÍSTICA LTDA;Aguardando coleta
29/09/2009;29/09/2009;;;C09090005221;194;Equipa Máquinas e Utensílios para Escritórios Ltda;SP;106;4;Revendedor;ATLAS LOGÍSTICA LTDA;Aguardando coleta
30/09/2009;30/09/2009;;;C09090005302;275;IDEECON CONSULTORIA EMPESARIAL LTDA;SP;10;5;Empresas / Estado de São Paulo;ATLAS LOGÍSTICA LTDA;Aguardando coleta
30/09/2009;30/09/2009;;;C09090005493;128;Prefeitura Municipal da Estancia Turistica de Embu ;sp;25;3;Órgãos Públicos e Empresas Estatais;ATLAS LOGÍSTICA LTDA;Aguardando coleta
30/09/2009;30/09/2009;;;C09090005574;219;FLC INDUSTRIA E COMERCIO DE PLASTICOS LTDA;SP;70;5;Empresas / Estado de São Paulo;ATLAS LOGÍSTICA LTDA;Aguardando coleta
30/09/2009;30/09/2009;;;C09090005655;298;GOLD NUTRITION INDUSTRIA E COMERCIO LTDA;SP;5;5;Empresas / Estado de São Paulo;ATLAS LOGÍSTICA LTDA;Aguardando coleta
30/09/2009;30/09/2009;;;C09090005736;299;WOW Indústria e Comércio Ltda.;SP;21;5;Empresas / Estado de São Paulo;ATLAS LOGÍSTICA LTDA;Aguardando coleta
30/09/2009;30/09/2009;;;C09090005817;119;BIRD SOLUTION LTDA;SP;90;4;Revendedor;ATLAS LOGÍSTICA LTDA;Aguardando coleta
